title,authors,desc, link,price
"Lady M. wyd. 2","[Ałbena Grabowska]","Fascynująca podróż po mrocznych zakamarkach kobiecej duszy Lady M.,  kolejna książka nowej królowej literatury kobiecej – Ałbeny Grabowskiej – to opowieść o małżeństwie, którego życie zmierza ku nieuchronnej katastrofie. Chorobliwie ambitna żona i mąż, który nie dojrzał do roli głowy rodziny, od długiego czasu toczą grę pozorów, by zachować kontrolę nad wspólnym życiem. Jednak tłumione od lat uczucia muszą znaleźć ujście. Tragedia wisi w powietrzu. Kto zapłaci za popełniony błąd?

 Ałbena Grabowska

 Popularna i ceniona pisarka, która swoje niezwykłe imię, oznaczające kwitnącą jabłoń, zawdzięcza bułgarskim korzeniom. Z wykształcenia lekarka, doktor nauk medycznych ze specjalizacją w neurologii i epileptologii. Popularność wśród czytelników zawdzięcza przede wszystkim bestsellerowej sadze Stulecie Winnych. Potencjał tej epickiej opowieści dostrzegli również filmowcy i w 2018 roku rozpoczęto realizację serialu w gwiazdorskiej obsadzie. Na antenie TVP zostały wyemitowane już dwie 13-odcinkowe serie, a kolejną, trzecią, widzowie będą mogli obejrzeć wiosną 2021 roku. Prócz Stulecia Winnych spod pióra Ałbeny Grabowskiej wyszły, m.in. trylogia Alicja w krainie czasów, kryminał Ostatnia chowa klucz, książka Tam, gdzie urodził się Orfeusz oraz wciągające powieści Lot nisko nad ziemią, Coraz mniej olśnień i Lady M. (Wydawnictwo Zwierciadło). Mieszka z trójką dzieci oraz trzema kotami w Brwinowie.                                         ",media/601a600418840.jpeg,"24,17"
"Kroniki zbrodni. Tajemnicze zaginięcia, seryjni mordercy, sprawy, których do dziś nie udało się wyjaśnić...","[Monika Całkiewicz,Robert Ziębiński]","Najbardziej wstrząsające zbrodnie ostatnich lat w Polsce

 Monika Całkiewicz jako prokurator przez lata badała motywy sprawców zabójstw i analizowała sposoby ich działania. W rozmowie z Robertem Ziębińskim odsłania kulisy spraw kryminalnych, które wstrząsnęły Polską XXI wieku. Spraw, o których słyszał każdy, ale i tych nieujawnianych przez lata. Krok po kroku analizuje przebieg zbrodni, pokazuje metody pracy organów ścigania i wyłapuje momenty, kiedy śledztwo mogło przybrać zupełnie inny obrót…

 Jak zmieniły się metody pracy policji i prokuratury na przestrzeni lat? Ile dzieli stalkera od wyrafinowanego mordercy? Jak duży wpływ na przebieg śledztwa mają media? I czy zabójca naprawdę jest w stanie zatuszować wszystkie ślady?

 Kroniki zbrodni to nie tylko mrożące krew w żyłach historie kryminalne, ale również dowód na to, że zło drzemiące w człowieku jest bliżej, niż nam się wydaje.

 Monika Całkiewicz – polska prawniczka, była prokurator, obecnie radczyni prawna i profesor w Akademii Leona Koźmińskiego w Warszawie. Ekspertka w dziedzinie kryminalistyki oraz postępowania karnego. Współautorka książki Zbrodnia prawie doskonała.

 Robert Ziębiński – dziennikarz, pisarz. W latach 2017–2019 redaktor naczelny „Playboya”. Publikował w „Tygodniku Powszechnym”, „Przekroju”, „Wprost”, „Polityce” i „Newsweeku”. W 2019 roku ukazała się jego książka poświęcona twórczości Stephena Kinga Stephen King. Instrukcja obsługi. Autor powieści sensacyjnych, kryminałów (Lockdown, Zabawka), horrorów (Dzień wagarowicza) oraz kontrowersyjnej książki o branży pornograficznej Porno. Jak oni to robią?

                                              ",media/5fda4da9ec4d9.jpg,"27,88"
"Ekspres na stacji. Jano i Wito uczą mówić","[Przemysław Liput,Wiola Wołoszyn]","                                     Jano i Wito, do tej pory znani z bestsellerowych książek kartonowych dla najmłodszych czytelników, teraz w nowej odsłonie!Cała rodzina rusza w podróż. Jadą na stację, aby wsiąść do pociągu. „Ekspres na stacji” to książka, która nie tylko pomoże nieco starszym dzieciom ćwiczyć wymowę głoski „s”, ale i nauczy, co robić, jeśli niespodziewanie stracą rodziców z oczu.Książka idealna dla starszych przedszkolaków.                                 ",media/600f091b2bc2f.jpg,"19,88"
"To, co najważniejsze","[Józef Tischner]","                                     Zbiór 21 tekstów Tischnera na XXI wiek.
  
  „Z myśleniem jest tak jak z chodzeniem: najpierw człowiek trzyma się ręki matki, a potem odkrywa, że już sam potrafi.""
  - ks. Józef Tischner
  
  Dla wielu słuchaczy i czytelników ks. Józef Tischner stał się właśnie takim przewodnikiem. Miał on w sobie niezwykły dar przyciągania ludzi. Przez swoje teksty nadal uczy nas patrzenia na świat, w którym sprzeczności nie znikają, ale mogą się harmonizować. Skłania do refleksji nad tym, co jest naprawdę ważne. Przekonuje, dlaczego należy dbać o wolność i jak z niej mądrze korzystać.
  
  Wojciech Bonowicz dokonał wyboru najważniejszych i najbardziej aktualnych tekstów ks. Tischnera, które pomagają rozumieć otaczającą nas rzeczywistość.                                 ",media/60098b752929d.jpg,"32,68"
"Wykończ tę książkę. Jak zakumplować się z książką z obrazkami","[Keri Smith]","                                     Mamy dosyć sztywnych reguł dotyczących czytania!
  
  - nie zaginać rogów, z książką obchodzić się ostrożnie, czytać po cichu – co za nuda!
  
  A gdyby tak stworzyć całkiem nowe zasady ?
  - potrząśnij książką!   
  - daj jej prztyczka! 
  - powąchaj ją!	
  - przytul !
  - spróbuj czytać ją do góry nogami! 
  
  Przecież książka to PRZYGODA i FRAJDA
  Keri Smith pomogła tysiącom ludzi na całym świecie wyzwolić kreatywność i odkryć nowe sposoby kontaktu z książką. Teraz autorka chce zaszczepić tę wrażliwość dzieciom i pomóc im bez kompleksów i uprzedzeń wejść w świat czytelnictwa.
  
  Wykończ tę książkę to zachęta do wiary we własne pomysły i otwarcia się na niedoskonałości. Pokazuje, że czytanie to wielka frajda i zabawa wszystkimi pięcioma zmysłami, a twórczy czytelnik lub czytelniczka jest najlepszym, co może przydarzyć się książce. 
  Bez nich, książka nigdy nie będzie wykończona…
  
  Keri Smith - jest autorką, ilustratorką i artystką, najbardziej rozpoznawalną za sprawą sprzedanej w kilku milionach egzemplarzy książki pt.  „Zniszcz ten dziennik”. Inne jej tytuły, to między innymi: „Zniszcz ten dziennik wszędzie”, „Łowca skarbów”, „Bałagan”, „Fantastyczny świat”. Prowadzi warsztaty kreatywne w oparciu o własne książki, ilustrowała też dla wielu czasopism, w tym dla „Washington Post” i „New York Times”. Lubi spędzać czas na zabawie z mężem i synem i dzieli swój czas między zachodnie Massachusetts i kanadyjską wioskę.                                 ",media/6051f03b5138d.jpg,"26,36"
"Przy stole z Hitlerem","[Rosella Postorino]","                                     Rodzice 26-letnej Rosy Sauer odeszli, a jej mąż Gregor walczy na wojenie. Zubożała i samotna podejmuje decyzję opuszczenia rozdartego wojną Berlina, by zamieszkać z teściemi na wsi. Wydaje jej się, że znajdzie tam schronienie. Pewnego ranka do ich dzwi pukają esesmani, aby oznajmić jej, że została powołana do bycia testerką Hitlera: trzy razy dziennie, ona i dziewięć innych kobiet udają sie do tajnej siedziby Hitlera w Wilczym Szańcu, aby próbować jego potraw, zamin on to zrobi.Zmuszone do jedzenia tego, co mogłoby je zabić, degustatorki zaczynają dzielić sie na dwie grupy: fanatyczki lojalne Hitlerowi oraz kobiety takie, jak Rosa upierające się, że nie są nazistkami, pomimo tego, że każdego dnia ryzykują własne życei dla Hitlera. W pewnym monęcie wszyscy zaczynają się zastanawiać, czy stoją po złej stronie historii.                                 ",media/5d2ea6962c1e3.jpg,"29,33"
"Miasteczko morderców. Róża Krull na tropie. Tom 4","[Alek Rogoziński]","                                     Popularna autorka powieści kryminalnych Róża Krull postanawia spełnić prośbę swojej gosposi i spróbować rozwiązać zagadkę morderstwa burmistrza w jej rodzinnym miasteczku na Podlasiu. Obie nie wierzą bowiem, aby został on zabity przez swojego niedoszłe - go zięcia, choć chłopaka złapano na gorącym uczynku.  Róża rozpoczyna amatorskie śledztwo w mieścinie, w której każdy wie „wszystko o wszystkich”, a mimo to wierzy, że akurat jemu uda się ukryć przed innymi własne, nieraz śmiertelne grzechy. Kiedy wydarza się kolejne morderstwo, pisarka jest pewna, że przyjęta do tej pory przez policję wersja wydarzeń mija się z prawdą. Pytanie tylko, czy zdoła odkryć tożsamość zabójcy, zanim ten wyśle ją na tamten świat...  „Miasteczko morderców” to osiemnasta powieść Alka Rogozińskiego – autora znanego z łączenia klasycznych fabuł kryminalnych z dużą dawką czarnego humoru.                                 ",media/6005cf122a77a.jpg,"24,99"
"Opowieści o nadziei","[Heather Morris]","                                     Każde - najbardziej zwykłe, codzienne spotkanie - może przynieść coś, co zmieni nasze życie.
  
  Kiedy Heather Morris wysłuchała wspomnień Lalego Sokołowa - tatuażysty z Auschwitz - i postanowiła przenieść je na papier, nie spodziewała się, że ta historia porwie miliony osób na świecie: młodych i starych, a jej przyniesie międzynarodową sławę. I że pozwoli opowiedzieć nie mniej ważną historię Cilki - najdzielniejszej osoby, z jaką zetknął się Lale. W swojej najnowszej książce Heather opowiada o serdecznej przyjaźni z Lalem: o tym, jak się poznali i jak zaufali sobie na tyle, by zwierzył się jej z tego, o czym milczał od czasu zakończenia II wojny światowej. I jak zmieniło to ich oboje.
  
  Umiejętność słuchania i dotarcia do drugiej osoby to nie tylko przepis na światowy sukces wydawniczy, ale przede wszystkim ważna życiowa lekcja, której wszyscy potrzebujemy. W serii inspirujących rozdziałów Morris opowiada zarówno o osobach, z którymi pracowała i których historie spisywała, jak i o swojej rodzinie: pełnych miłości relacjach z Dziadkiem, ale także ucieczce z domu oraz trudnych kontaktach z matką. 
  
  Opowieści o nadziei to przede wszystkim pochwała życia i zacieśniania więzi.
  
  Heather Morris pochodzi z Nowej Zelandii, a obecnie mieszka w Australii. Pracując w szpitalu w Melbourne, przez kilka lat czytała i pisała scenariusze. W 2003 roku spotkała starszego pana, który „miał historię wartą opowiedzenia&quot;. W miarę, jak rozwijała się ich przyjaźń, Lale Sokołow otwierał przed nią najgłębsze zakamarki duszy, powierzając jej tajemnice życia w czasach Zagłady. Powieści Tatuażysta z Auschwitz i Podróż Cilki stały się bestsellerami wszędzie, gdzie się ukazały.
                                   ",media/601a6d9c8846e.jpg,"24,40"
"Niedźwiedź, pianino, pies i skrzypce","[DAVID LITCHFIELD]","Co my zrobimy, Hugo? – zapytał Hektor, gdy wracali do domu. – Moje występy już nikogo nie obchodzą. Kto by chciał słuchać starego skrzypka, kiedy może obejrzeć koncert niedźwiedzia grającego na pianinie?

 Hektor i jego pies Hugo wspierali się nawzajem i wspólnie tworzyli muzykę od lat. Lecz gdy Hugo uczy się gry na skrzypcach i otrzymuje szansę zagrania w zespole niedźwiedzia, Hektor staje się bardzo zazdrosny. Czy będzie w stanie przełknąć dumę i cieszyć się z sukcesu przyjaciela?

 Wyjątkowa opowieść o sile przyjaźni i spełnianiu marzeń. Kontynuacja książki Niedźwiedź i pianino, nagrodzonej w 2016 roku Waterstone’s Children’s Book Prize w kategorii najlepsze ilustracje.                                         ",media/601aafbc1ab4d.jpg,"20,20"
